{
  "id": "c1s2",
  "chapterId": "ch1",
  "order": 2,
  "movementTier": "A",
  "background": "bg_meadow_day",
  "narration": "Milo smiles a big smile. Playing together makes the meadow feel even sunnier. The path home glows softly.",
  "avatarStart": [820, 840],
  "characters": [
    { "assetRef": "char_milo", "id": "milo", "position": [980, 820], "expression": "relieved_grin" },
    { "assetRef": "char_companion_fox", "id": "companion", "position": [640, 860], "expression": "excited_glow" },
    { "assetRef": "char_grownup", "id": "grownup", "position": [1650, 780] }
  ],
  "triggers": [
    { "id": "path_home", "bounds": [1560, 620, 280, 320], "action": "completeChapter", "target": "ch1" }
  ],
  "collectibles": [
    { "id": "spark_c1_2", "assetRef": "collectible_spark", "position": [1240, 920], "kind": "kindness_spark" }
  ],
  "decisionPoints": [],
  "version": "1.0.0",
  "owner": "content-team",
  "approvalState": "draft",
  "lastSmeReviewDate": "2026-07-07"
}
