{
  "id": "w2",
  "chapterId": "ch2",
  "order": 2,
  "movementTier": "B",
  "background": "bg_clearing_day",
  "narration": "Robin keeps looking up at the ladder. The other kids are already in the treehouse. A worry cloud hangs over Robin's head.",
  "avatarStart": [360, 860],
  "characters": [
    { "assetRef": "char_robin", "id": "robin", "position": [960, 780], "expression": "worried" },
    { "assetRef": "char_companion_fox", "id": "companion", "position": [720, 860] }
  ],
  "fx": [
    { "assetRef": "fx_worry_cloud", "id": "worry_cloud", "position": [960, 520], "variant": "big" }
  ],
  "triggers": [
    { "id": "robin_encounter", "bounds": [860, 660, 220, 260], "action": "startDecision", "target": "dp_robin_ladder" }
  ],
  "collectibles": [],
  "decisionPoints": ["dp_robin_ladder"],
  "version": "1.0.0",
  "owner": "content-team",
  "approvalState": "draft",
  "lastSmeReviewDate": "2026-07-07"
}
